Video Title,Number of Viewers,Video posting date,Video Length
Helping Mommy Song - ChuChu TV Baby Nursery Rhymes and Kids Songs,"1,043,193 views","Mar 27, 2021",3:55
Traveling Song + More ChuChu TV Baby Nursery Rhymes & Kids Songs,"2,830,854 views","Mar 17, 2021",46:14
Restaurant at Home Song - ChuChu TV Baby Nursery Rhymes and Kids Songs,"6,138,882 views","Mar 6, 2021",4:41
Beach at Home Song - ChuChu TV Baby Nursery Rhymes and Kids Songs,"5,845,715 views","Feb 18, 2021",4:04
ChuChu TV Numbers Song - Learn to Count from 1 to 20 | Number Rhymes For Children,"19,206,154 views","Feb 3, 2021",6:34
Yes Yes Bedtime Song + More ChuChu TV 3D Baby Nursery Rhymes and Kids Songs,"33,280,810 views","Jan 23, 2021",48:51
Picnic at Home Song - ChuChu TV Baby Nursery Rhymes and Kids Songs,"5,549,449 views","Dec 23, 2020",4:23
"Deck the Halls, Ha Ha Ha Ha Ha! - Christmas Song For Kids - ChuChu TV Baby Nursery Rhymes for Babies","23,686,423 views","Dec 11, 2020",4:31
Christmas Rain Rain Go Away Song - ChuChu TV Baby Nursery Rhymes and Kids Songs,"15,454,753 views","Dec 5, 2020",3:36
The Humpty Dumpty Game - ChuChu TV Baby Nursery Rhymes & Kids Songs,"4,027,045 views","Nov 28, 2020",3:47
Wheels on the Bus Song - Baby Starts Crying + More ChuChu TV 3D Baby Nursery Rhymes and Kids Songs,"22,705,400 views","Nov 21, 2020",48:15
Movie at Home Song - ChuChu TV Baby Nursery Rhymes & Kids Songs,"17,320,572 views","Nov 14, 2020",4:03
Traveling Song - ChuChu TV Baby Nursery Rhymes & Kids Songs,"26,629,003 views","Nov 7, 2020",6:08
First Day of School Song + More ChuChu TV Baby Nursery Rhymes & Kids Songs,"12,658,418 views","Nov 3, 2020",31:24
Yes Yes Bedtime Song - ChuChu TV Baby Nursery Rhymes & Kids Songs,"16,043,067 views","Oct 28, 2020",6:39
First Day of School Song - ChuChu TV Baby Nursery Rhymes & Kids Songs,"18,450,690 views","Oct 24, 2020",5:45
Rain Rain Go Away Halloween🎃 Song with Babies + More ChuChu TV Nursery Rhymes & Kids Songs,"9,707,915 views","Oct 21, 2020",39:51
Baby Goes Fishing Song + More ChuChu TV Baby Nursery Rhymes & Kids Songs,"6,326,505 views","Oct 17, 2020",35:18
Rain Rain Go Away Halloween🎃 Song with Babies - ChuChu TV Nursery Rhymes & Kids Songs,"5,749,761 views","Oct 13, 2020",3:40
*NEW* Baby Shoes Song + More ChuChu TV Baby Nursery Rhymes & Kids Songs,"8,708,789 views","Oct 10, 2020",33:27
Yes Yes Stay Safe Song (Healthy Habits) + More ChuChu TV Baby Nursery Rhymes & Kids Songs,"9,437,217 views","Oct 3, 2020",0:20
Baby Shoes Song - ChuChu TV Baby Nursery Rhymes & Kids Songs,"12,627,066 views","Sep 29, 2020",3:43
ChuChu TV Classics - Days of the Week Song | Nursery Rhymes and Kids Songs,"1,832,313 views","Sep 26, 2020",3:29
"Black or White, We All Are One - ChuChu TV Nursery Rhymes & Kids Songs","2,291,083 views","Sep 21, 2020",4:42
ChuChu TV Classics - Months of the Year Song | Nursery Rhymes and Kids Songs,"1,397,710 views","Sep 11, 2020",4:44
Yes Yes Stay Safe Song - @ChuChu TV Nursery Rhymes & Kids Songs,"8,359,369 views","Sep 8, 2020",5:07
ChuChu TV Classics - Five Little Monkeys - The Robot Monkeys | Nursery Rhymes and Kids Songs,"2,197,017 views","Sep 4, 2020",4:39
The Boo Boo Song 2 with Toys + More @ChuChu TV Nursery Rhymes & Kids Songs,"42,997,450 views","Sep 1, 2020",1:04:22
Wheels on the Bus with Farm Animals - ChuChu TV Nursery Rhymes & Kids Songs,"5,262,879 views","Aug 25, 2020",4:07
Rain Rain Go Away Song + More ChuChu TV Baby Nursery Rhymes & Kids Songs,"4,137,633 views","Aug 20, 2020",42:54
The Boo Boo Song 2 with Toys - ChuChu TV Nursery Rhymes & Kids Songs,"19,484,156 views","Aug 13, 2020",5:51
Safe ways to meet and greet during the Coronavirus Pandemic from ChuChu & Friends - ChuChu TV,"1,992,963 views","Aug 9, 2020",2:02
Baby goes to Old MacDonald’s Farm + More ChuChu TV Baby Nursery Rhymes & Kids Songs,"6,581,419 views","Aug 7, 2020",1:02:37
Baby's First Teeth Song - ChuChu TV Nursery Rhymes & Kids Songs,"2,485,915 views","Jul 28, 2020",3:30
ChuChu TV Classics - Phonics Song with Two Words | Nursery Rhymes and Kids Songs,"187,988,503 views","Jul 24, 2020",4:56
Pat a Cake 2 - Cakes for Occasions - ChuChu TV Nursery Rhymes & Kids Songs,"2,196,652 views","Jul 22, 2020",3:41
Baby goes to Old MacDonald’s Farm - ChuChu TV Nursery Rhymes & Kids Songs,"24,962,873 views","Jul 14, 2020",4:28
ChuChu's Baa Baa Black Sheep - ChuChu TV Nursery Rhymes & Kids Songs,"2,672,827 views","Jul 3, 2020",3:04
Baby's Humpty Dumpty Song + More ChuChu TV Baby Nursery Rhymes & Kids Songs,"12,209,759 views","Jun 30, 2020",1:03:24
Emotions (Feelings) Song - ChuChu TV Nursery Rhymes & Kids Songs,"5,541,873 views","Jun 23, 2020",2:57
Baby's First Steps Song + More ChuChu TV Baby Nursery Rhymes & Kids Songs,"6,004,859 views","Jun 19, 2020",32:41
Baby's Humpty Dumpty Song - ChuChu TV Nursery Rhymes & Kids Songs,"10,054,398 views","Jun 16, 2020",3:17
Baby's First Steps Song - ChuChu TV Nursery Rhymes & Kids Songs,"3,212,429 views","Jun 12, 2020",4:08
ChuChu TV Classics - Johny Johny Yes Papa - Sugar | Nursery Rhymes and Kids Songs,"6,790,576 views","Jun 9, 2020",2:29
ChuChu TV Classics - Baa Baa Black Sheep Song | Nursery Rhymes and Kids Songs,"6,522,661 views","Jun 2, 2020",3:04
Bath Song 2 - ChuChu TV Nursery Rhymes & Kids Songs,"5,595,466 views","May 26, 2020",4:39
No No Brush My Teeth Song + More ChuChu TV Baby Nursery Rhymes & Kids Songs,"5,053,033 views","May 19, 2020",31:20
ChuChu TV Classics - Let's Learn The Colors! | Nursery Rhymes and Kids Songs,"8,642,672 views","May 12, 2020",3:27
ChuChu TV Classics - Head Shoulders Knees & Toes Dance Song | Nursery Rhymes and Kids Songs,"3,899,787 views","Apr 29, 2020",2:24
ChuChu TV Classics - Ten in the Bed Song | Nursery Rhymes and Kids Songs,"16,222,823 views","Mar 31, 2020",4:23
Baby Care and Share Song - ChuChu TV Nursery Rhymes & Kids Songs,"3,504,472 views","Mar 24, 2020",3:14
Wash Your Hands Song + More Healthy Habits songs for Kids | ChuChu TV Classics,"9,319,383 views","Mar 17, 2020",33:53
No No Brush My Teeth Song - ChuChu TV Nursery Rhymes & Kids Songs,"40,113,556 views","Mar 10, 2020",3:44
No No Milk Song + More ChuChu TV Baby Nursery Rhymes & Kids Songs,"129,050,471 views","Mar 5, 2020",33:51
The Muffin Man - ChuChu TV Nursery Rhymes & Kids Songs,"4,877,958 views","Feb 28, 2020",4:11
Doctor Checkup Song + More ChuChu TV Baby Nursery Rhymes & Kids Songs,"54,615,836 views","Feb 18, 2020",36:33
No No Milk Song - ChuChu TV Nursery Rhymes & Kids Songs,"7,442,170 views","Feb 12, 2020",3:11
Color Song - The Wheels On The Bus - ChuChu TV Nursery Rhymes & Kids Songs,"12,848,260 views","Jan 22, 2020",4:36
ChuChu TV Classics - Three Little Kittens Went to the Park | Nursery Rhymes and Kids Songs,"3,582,604 views","Jan 17, 2020",3:46
ABC Alphabet & Numbers for Kids - ChuChu TV Learning Songs for Kids,"136,397,155 views","Jan 14, 2020",49:26
ChuChu TV Classics - ABCD Song in Alphabet Water Park | Nursery Rhymes and Kids Songs,"5,860,901 views","Jan 10, 2020",3:18
Hello Song - ChuChu TV Nursery Rhymes & Kids Songs,"4,488,141 views","Jan 7, 2020",3:55
ChuChu TV Classics - Numbers Song - Learn to Count from 1 to 10 | Nursery Rhymes and Kids Songs,"89,675,260 views","Jan 3, 2020",4:38
ABC Song with ChuChu Toy Train - Alphabet Song for Kids - ChuChu TV,"52,178,768 views","Dec 24, 2019",3:44
Jingle Bells Song + More ChuChu TV Christmas Songs & Nursery Rhymes for Kids,"4,271,446 views","Dec 20, 2019",11:59
Jingle Bells - Spirit of Love - ChuChu TV Christmas Songs & Nursery Rhymes for Kids,"8,145,803 views","Premiered Dec 12, 2019",4:53
Yes Yes Fruits Song + More ChuChu TV Baby Nursery Rhymes & Kids Songs,"22,950,256 views","Dec 3, 2019",51:58
ChuChu TV Classics - Wheels On The Bus - Kenya Wildlife Safari | Nursery Rhymes and Kids Songs,"2,922,617 views","Nov 29, 2019",4:32
Doctor Checkup Song - ChuChu TV Nursery Rhymes & Kids Songs,"21,663,864 views","Nov 26, 2019",0:29
ChuChu TV Classics - Wheels On The Bus - London City | Nursery Rhymes and Kids Songs,"2,583,624 views","Nov 22, 2019",4:00
Yes Yes Fruits Song - ChuChu TV Nursery Rhymes & Kids Songs,"12,678,813 views","Nov 19, 2019",6:38
ChuChu TV Classics - Rain Rain Go Away | Nursery Rhymes and Kids Songs,"64,981,717 views","Nov 15, 2019",2:55
The Boo Boo Song + More ChuChu TV Baby Nursery Rhymes & Kids Songs,"699,088,300 views","Nov 11, 2019",42:18
ChuChu TV Classics - Five Little Monkeys Jumping On The Bed | Nursery Rhymes and Kids Songs,"3,749,515 views","Nov 8, 2019",2:51
*New* Wheels on the Bus Song - Baby Starts Crying | ChuChu TV 3D Nursery Rhymes and Kids Songs,"14,852,110 views","Nov 4, 2019",3:57
ChuChu TV Classics - Chubby Cheeks Dimple Chin | Nursery Rhymes and Kids Songs,"1,449,919 views","Nov 1, 2019",2:04
ChuChu TV Classics - Twinkle Twinkle Little Star | Nursery Rhymes and Kids Songs,"2,255,520 views","Oct 28, 2019",2:46
The Boo Boo Song - ChuChu TV Nursery Rhymes & Kids Songs,"96,115,039 views","Oct 22, 2019",5:21
ChuChu TV Classics - Wheels on the Bus - Part 2 | Nursery Rhymes and Kids Songs,"34,894,501 views","Oct 19, 2019",2:24
ChuChu TV Classics - Wheels on the Bus Song - Part 1 | Nursery Rhymes and Kids Songs,"16,509,111 views","Oct 17, 2019",2:24
Halloween is Here Song - SCARY & SPOOKY + More ChuChu TV Nursery Rhymes & Kids Songs,"9,803,898 views","Oct 16, 2019",34:54
Farm Animals Song with Chu Chu Toy Train - Animal Sounds Song - ChuChuTV Peek & Play Surprise Eggs,"9,695,831 views","Oct 7, 2019",6:42
ChuChu TV Classics - Humpty Dumpty + More Popular Baby Nursery Rhymes,"5,509,034 views","Sep 29, 2019",28:19
ChuChu TV Pro App 2.0 – 1000’s of Nursery Rhymes Videos with 100’s Of Learning Activities for Kids,"5,484,280 views","Sep 20, 2019",1:50
Baa Baa Black Sheep Rainbow Song + More ChuChu TV Baby Nursery Rhymes & Kids Songs,"16,702,857 views","Sep 16, 2019",32:33
Little Boy Blue Song - ChuChuTV Surprise Eggs Nursery Rhymes,"949,177 views","Sep 10, 2019",2:55
Swimming Song + More ChuChu TV Baby Nursery Rhymes & Kids Songs,"7,605,034 views","Aug 29, 2019",33:18
"ChuChu TV Five Little Monkeys Game - Available in Amazon, Walmart and Target in the USA","826,871 views","Aug 27, 2019",4:48
*New* Baa Baa Black Sheep Song - Colors of the Rainbow - ChuChu TV Nursery Rhymes,"91,320,842 views","Aug 22, 2019",4:47
"ChuChu TV Wheels On The Bus Game - Available in Amazon, Walmart and Target in the USA","906,504 views","Aug 16, 2019",2:43
Hickory Dickory Dock + More ChuChu TV Baby Nursery Rhymes & Kids Songs,"3,373,144 views","Aug 12, 2019",34:27
Baby Goes Swimming Song | ChuChu TV Nursery Rhymes & Kids Songs,"25,643,209 views","Aug 5, 2019",3:38
Johny Johny Yes Papa - Grandparents Song + More Nursery Rhymes by ChuChu TV,"32,712,983 views","Jul 29, 2019",33:59
*New* Hickory Dickory Dock | ChuChu TV Nursery Rhymes & Kids Songs,"34,764,754 views","Jul 22, 2019",2:50
"ChuChu TV Classics - Head, Shoulders, Knees & Toes Exercise Song + More Popular Baby Nursery Rhymes","37,018,373 views","Jul 18, 2019",29:17
Yes Yes Go to School Song + More ChuChu TV Baby Nursery Rhymes & Kids Songs,"34,425,397 views","Jul 12, 2019",33:27
Johny Johny Yes Papa - Grandparents Version - ChuChu TV Nursery Rhymes & Kids Songs,"97,795,683 views","Jul 9, 2019",2:55
*New* Twinkle Twinkle Little Star 3 Song + More Nursery Rhymes & Kids Songs | ChuChu TV,"6,719,459 views","Jul 2, 2019",34:46
*New* No No Yes Yes Go to School Song - ChuChu TV Baby Nursery Rhymes & Kids Songs,"546,919,434 views","Jun 25, 2019",4:52
Baby is Sick Song + More Nursery Rhymes by ChuChu TV,"46,290,400 views","Jun 18, 2019",33:30
Baby Loves Stargazing - Twinkle Twinkle Little Star 3 - ChuChu TV Baby Nursery Rhymes & Lullabies,"72,752,907 views","Jun 11, 2019",3:15
*New* Johny Johny Yes Papa Confetti Song + More ChuChu TV 3D Nursery Rhymes & Kids Songs,"14,829,731 views","Jun 7, 2019",31:35
*New* Sick Song | ChuChu TV Nursery Rhymes & Baby Songs,"89,139,794 views","May 29, 2019",4:18
NEW Johny Johny Yes Papa Song - Confetti & Chocolate Wrappers - ChuChu TV Nursery Rhymes For Kids,"6,752,633 views","May 16, 2019",2:32
Yes Yes Wake Up Song + More ChuChu TV 3D Nursery Rhymes & Kids Songs,"16,673,499 views","May 7, 2019",31:26
Pat a Cake Song | ChuChu TV Nursery Rhymes & Kids Songs,"115,075,296 views","Apr 22, 2019",2:57
This Little Piggy + More ChuChu TV 3D Nursery Rhymes & Kids Songs,"7,945,676 views","Apr 16, 2019",30:44
Phonics Song 2 with TWO Words in 3D - A For Airplane - ABC Alphabet Songs with Sounds for Children,"857,704,761 views","Apr 10, 2019",5:22
Yes Yes Wake Up Song | ChuChu TV Nursery Rhymes & Kids Songs,"65,674,432 views","Apr 3, 2019",2:36
This Is The Way We Brush Our Teeth Good Habits Song + More ChuChu TV 3D Nursery Rhymes & Kids Songs,"18,790,224 views","Mar 26, 2019",33:20
This Little Piggy - ChuChu TV 3D Nursery Rhymes & Kids Songs,"18,395,566 views","Mar 19, 2019",2:32
The Letter V Phonics Song – V For Venus - ABC Songs with Sounds for Children – Learning English,"600,131 views","Mar 16, 2019",6:32
Baby Shark - Great White Shark - Learn Shark Names For Children - ChuChuTV Nursery Rhymes & Songs,"17,639,411 views","Mar 12, 2019",3:13
Johny Johny Yes Papa Ice Cream Song + More 3D Nursery Rhymes & Kids Songs - ChuChu TV,"16,811,776 views","Mar 7, 2019",34:24
Hickety Pickety My Cute Hen - ChuChu TV Nursery Rhymes & Kids Songs,"14,739,072 views","Mar 4, 2019",2:12
Twinkle Twinkle Little Star + More 3D Nursery Rhymes & Kids Songs - ChuChu TV,"14,264,326 views","Feb 26, 2019",33:10
Johny Johny Yes Papa - Ice Cream Song - ChuChu TV Nursery Rhymes,"47,053,324 views","Feb 22, 2019",2:37
ChuChu's Twinkle Twinkle Little Star - ChuChu TV Nursery Rhymes,"51,347,921 views","Feb 18, 2019",4:42
The Letter U Phonics Song – U For Unicorn - ABC Songs with Sounds for Children – Learning English,"670,736 views","Feb 14, 2019",5:31
Cock-a-Doodle-Doo - ChuChu TV Nursery Rhymes & Kids Songs,"15,624,691 views","Feb 12, 2019",2:11
Five Senses Song + More 3D Nursery Rhymes & Kids Songs - ChuChu TV,"4,518,564 views","Feb 7, 2019",32:42
Chiku Had A Little Dino - ChuChu TV 3D Nursery Rhymes & Kids Songs,"45,849,170 views","Feb 4, 2019",3:07
Rain Rain Go Away + More 3D Nursery Rhymes & Kids Songs - ChuChu TV,"44,033,989 views","Jan 29, 2019",24:00
Rain Rain Go Away Song - ChuChu TV Funzone 3D Nursery Rhymes & Kids Songs,"31,950,826 views","Jan 21, 2019",2:15
Animal Homes Song + More Nursery Rhymes & Kids Songs - ChuChu TV,"26,453,069 views","Jan 14, 2019",33:36
This Is The Way We Brush Our Teeth - ChuChu TV Funzone 3D Nursery Rhymes & Kids Songs,"154,202,448 views","Jan 8, 2019",3:18
Animal Homes Song - ChuChu TV Nursery Rhymes & Kids Songs,"13,690,715 views","Jan 2, 2019",3:03
Jack and Jill Went Up The Hill + More Nursery Rhymes & Kids Songs - ChuChu TV,"32,456,464 views","Dec 20, 2018",44:29
Jack and Jill - ChuChu TV Nursery Rhymes & Kids Songs,"27,309,608 views","Dec 13, 2018",2:03
Johny Johny Yes Papa All Songs Collection - ChuChu TV Nursery Rhymes & Songs For Babies,"48,786,912 views","Nov 19, 2018",16:10
I Love You Baby Song - 3D Animation Nursery Rhymes & Songs For Babies - ChuChu TV For Kids,"44,252,700 views","Nov 14, 2018",4:38
Johny Johny Yes Papa Peekaboo – 3D Animation Nursery Rhymes & Songs For Babies - ChuChuTV For Kids,"271,101,532 views","Nov 1, 2018",2:13
ChuChu TV Learning English Is Fun™ | Alphabet T Song | Phonics & Words For Preschool Children,"817,302 views","Oct 30, 2018",6:23
Food Alphabets ABC Phonics Song & Many More Nursery Rhymes & Kids Songs | ChuChu TV,"26,349,412 views","Oct 27, 2018",46:48
Food Alphabets ABC Phonics Song - A For Apple Pie - Alphabet Rhymes with Sounds for Children,"24,671,944 views","Oct 8, 2018",7:27
Bath Song | Let's take a Bath | ChuChu TV 3D Nursery Rhymes & Songs for Babies,"37,544,830 views","Sep 26, 2018",2:55
Healthy Habits Song & Many More Nursery Rhymes for Kids & Songs for Babies by ChuChu TV,"6,159,065 views","Sep 17, 2018",42:23
Ten Little Boys and Girls - Learning Numbers Song - ChuChu TV Number Rhymes & Songs for Babies,"16,656,878 views","Sep 12, 2018",2:21
Learn Dinosaur Names with Dino Finger Family - 3D Nursery Rhymes & Baby Songs by ChuChu TV,"9,853,847 views","Sep 7, 2018",2:27
ChuChu TV Learning English Is Fun™ | Alphabet S Song | Phonics & Words For Preschool Children,"727,228 views","Sep 6, 2018",5:48
Jack Be Nimble Nursery Rhyme | ChuChu TV Nursery Rhymes & Songs for Babies,"16,938,864 views","Aug 31, 2018",2:14
Baby shark doo doo doo doo | 3D Nursery Rhymes & Baby Songs by ChuChu TV,"16,837,170 views","Aug 18, 2018",2:41
What do you want to be? Jobs Song - Professions Part 2 - ChuChu TV Nursery Rhymes & Songs for Babies,"118,878,866 views","Aug 7, 2018",3:05
PQR Songs | ChuChu TV Learning English Is Fun™ | ABC Phonics & Words Learning For Preschool Children,"901,841 views","Aug 3, 2018",11:23
You put your right hand in - Teeki Taaki Action Song - Nursery Rhymes & Songs For Babies - ChuChu TV,"24,933,926 views","Jul 24, 2018",2:36
Phonics Song (Xylophone Version) - A For Apple - ABC Alphabet Songs with Sounds for Children,"54,435,240 views","Jul 20, 2018",4:16
What do you want to be? Jobs Song - Professions Part 1 - ChuChu TV Nursery Rhymes & Songs for Babies,"13,453,751 views","Jul 17, 2018",3:08
ChuChu TV Learning English Is Fun™ | Alphabet Q Song | Phonics & Words For Preschool Children,"945,778 views","Jul 12, 2018",6:07
Babies Play Peek a Boo to Surprise Daddy - Johny Johny Yes Papa Song - Ball Pit Show for Kids,"38,897,926 views","Jul 3, 2018",2:17
Healthy Habits Song for Kids - ChuChu TV Nursery Rhymes & Baby Songs,"10,600,792 views","Jun 26, 2018",2:36
Teeki Taaki Dance Song and Many More Nursery Rhymes & Songs for Babies by ChuChu TV,"7,265,887 views","Jun 19, 2018",43:15
Are You Sleeping Little Johny? Farm Animals Song for Babies | ChuChu TV Nursery Rhymes & Kids Songs,"10,056,960 views","Jun 12, 2018",51:43
ChuChu TV Learning English Is Fun™ | Alphabet P Song | Phonics & Words For Preschool Children,"1,008,228 views","Jun 6, 2018",6:20
Johny Johny Yes Papa Family Song plus Many More Nursery Rhymes & Songs for Babies by ChuChu TV,"10,795,117 views","Jun 4, 2018",41:58
Johny Johny Yes Papa Family Song for Babies | ChuChu TV Nursery Rhymes & Songs For Children,"240,412,396 views","May 22, 2018",2:28
Are You Sleeping? Little Johny - Farm Animals Songs for Kids - ChuChu TV Nursery Rhymes,"20,853,271 views","May 28, 2018",2:59
MNO Songs | ChuChu TV Learning English Is Fun™ | ABC Phonics & Words Learning For Preschool Children,"1,347,561 views","May 19, 2018",11:27
The Teeki Taaki Dance - Sing & Dance | Nursery Rhymes and Songs for Babies & Kids by ChuChu TV,"14,828,896 views","May 15, 2018",2:55
ChuChu TV Learning English Is Fun™ | Alphabet O Song | Phonics & Words For Preschool Children,"1,013,069 views","May 10, 2018",6:33
Are You Sleeping (Little Johny)? | Nursery Rhymes & Animals songs for Kids by ChuChu TV,"33,417,645 views","Apr 30, 2018",2:56
Three Little Kittens Went To The Zoo (SINGLE) | Nursery Rhymes by Cutians | ChuChu TV Kids Songs,"7,202,923 views","Apr 12, 2018",4:23
Baby Shark Numbers Song | Learn Numbers with Baby Sharks | Nursery Rhymes & Kids Songs by ChuChu TV,"13,694,099 views","Apr 8, 2018",0:29
Baby Shark ABC Song and Many More Videos | ChuChu TV Popular Nursery Rhymes Collection,"5,386,600 views","Apr 2, 2018",55:51
ChuChu TV Baby Shark ABC | Learn Alphabets with Baby Sharks & Friends | Nursery Rhymes & Kids Songs,"7,788,739 views","Mar 27, 2018",4:16
ChuChu TV Learning English Is Fun™ | Alphabet N Song | Phonics & Words For Preschool Children,"1,305,055 views","Mar 21, 2018",6:22
ChuChu TV Baby Shark - Park Song and Many More Videos | Popular Nursery Rhymes Collection,"4,116,247 views","Mar 14, 2018",51:28
ChuChu TV Alphabet Animals Song with Animal Names & Animal Sounds | Nursery Rhymes for Kids,"47,169,852 views","Mar 5, 2018",1:17:19
ChuChu TV Learning English Is Fun™ | Alphabet M Song | Phonics & Words For Preschool Children,"1,805,192 views","Feb 26, 2018",6:11
JKL Songs | ChuChu TV Learning English Is Fun™ | ABC Phonics & Words Learning For Preschool Children,"2,250,084 views","Feb 20, 2018",12:07
ChuChu TV Baby Shark - Park Song | Animal Songs for Children | Nursery Rhymes & Kids Songs,"7,542,271 views","Feb 14, 2018",3:11
"ChuChu TV Alphabet Animals – Learn the Alphabets, Animal Names & Animal Sounds | ABC Songs for Kids","49,752,928 views","Feb 5, 2018",5:10
Three Little Kittens Went To The Farm (SINGLE) | Nursery Rhymes by Cutians | ChuChu TV Kids Songs,"2,631,406 views","Feb 2, 2018",3:37
ChuChu TV Baby Shark - Good Habits and Many More Videos | Popular Nursery Rhymes Collection,"31,283,737 views","Jan 24, 2018",46:11
Three Little Kittens Went To The Fair (SINGLE) | Nursery Rhymes by Cutians | ChuChu TV Kids Songs,"5,786,274 views","Jan 22, 2018",4:11
ChuChu TV Baby Shark – Good Habits Song | Animal Songs for Children | Nursery Rhymes & Kids Songs,"68,941,537 views","Jan 18, 2018",4:58
ChuChu TV Learning English Is Fun™ | Alphabet K Song | Phonics & Words For Preschool Children,"2,078,325 views","Jan 12, 2018",6:50
Good Morning Song and Many More Videos | Popular Nursery Rhymes Collection by ChuChu TV For Kids,"14,411,578 views","Jan 9, 2018",41:41
Wake Wake Wake Up Now and Many More Videos | Popular Nursery Rhymes Collection by ChuChu TV For Kids,"6,610,740 views","Jan 4, 2018",27:38
"Say Please, Sorry and Thank You! - Good Habits For Children | ChuChu TV Nursery Rhymes & Kids Songs","9,013,128 views","Jan 2, 2018",2:56
Good Morning Song - Good Habits For Children | ChuChu TV Nursery Rhymes & Kids Songs,"22,004,460 views","Dec 30, 2017",2:52
ABCDEFGHIJ songs with Phonics Sounds & Words for Children | Learning English with ChuChu TV,"3,587,688 views","Dec 29, 2017",27:21
ChuChu TV Grape Song (SINGLE) | Learn Fruits for Kids | Educational Songs & Nursery Rhymes,"6,064,198 views","Dec 23, 2017",2:46
GHI Songs | Learning English Is Fun™ | ChuChu TV Phonics & Words Learning For Preschool Children,"1,396,002 views","Dec 21, 2017",12:46
Download ChuChu TV Pro Learning App for Kids and Watch All Videos AD-Free with Activity and Games!,"6,706,469 views","Dec 19, 2017",1:14
Wake Wake Wake Up Now Early In the Morning | Good Habits Nursery Rhymes For Children | ChuChu TV,"13,626,106 views","Dec 18, 2017",2:45
ChuChu TV Baby Shark and Many More Videos | Popular Nursery Rhymes Collection,"40,804,709 views","Dec 16, 2017",34:10
Learning English Is Fun™ | Alphabet “J” | ChuChu TV Phonics & Words Learning For Preschool Children,"1,294,376 views","Dec 14, 2017",6:15
Baby Shark Song | Sing and Dance | Animal Songs for Children | ChuChu TV Nursery Rhymes & Kids Songs,"41,598,643 views","Dec 11, 2017",5:33
Three Little Kittens Went To The Park - (NEW Cutians) | ChuChu TV Baby Nursery Rhymes & Kids Songs,"13,310,306 views","Dec 8, 2017",3:39
Incy Wincy Spider (SINGLE) | Nursery Rhymes by Cutians | ChuChu TV Kids Songs,"2,384,872 views","Dec 5, 2017",2:59
Three Little Kittens Went To The Swimming Pool (SINGLE) | Nursery Rhymes by Cutians | ChuChu TV Kids,"3,935,852 views","Dec 4, 2017",5:02
Plum Song | Learn Fruits for Kids | Fruits Songs Collection | ChuChu TV Nursery Rhymes & Kids Songs,"5,996,434 views","Nov 30, 2017",15:40
Five Little Ducks (SINGLE) | Nursery Rhymes by Cutians | ChuChu TV Kids Songs,"3,916,142 views","Nov 28, 2017",3:08
"Learn Actions Words for Kids with ChuChu TV Surprise Eggs Toys & Nursery Rhymes | Snapping, Jumping","45,158,444 views","Nov 22, 2017",11:47
Three Little Kittens Went To The Swimming Pool and Many More Nursery Rhymes by Cutians | ChuChu TV,"9,202,811 views","Nov 20, 2017",24:37
Learning English Is Fun™ | Alphabet “I” | ChuChu TV Phonics & Words Learning For Preschool Children,"2,104,287 views","Nov 16, 2017",7:03
Wheels On The Bus (SINGLE) | Nursery Rhymes by Cutians | ChuChu TV Kids Songs,"4,677,896 views","Nov 13, 2017",3:12
Three Little Kittens Went To The Theme Park (SINGLE) | Nursery Rhymes & Songs by Cutians | ChuChu TV,"2,071,921 views","Nov 2, 2017",4:12
Banana Song (SINGLE) | Learn Fruits for Kids | Educational Learning Songs Nursery Rhymes | ChuChu TV,"12,760,680 views","Oct 27, 2017",2:45
Learning English Is Fun™ | Alphabet “H” | ChuChu TV Phonics & Words Learning For Preschool Children,"1,835,539 views","Oct 24, 2017",6:51
Baa Baa Black Sheep (SINGLE) | Nursery Rhymes by Cutians | ChuChu TV Kids Songs,"7,607,315 views","Oct 23, 2017",3:27
Rain Rain Go Away (SINGLE) | Nursery Rhymes by Cutians | ChuChu TV Kids Songs,"20,738,283 views","Oct 21, 2017",4:00
Orange Song (SINGLE) | Learn Fruits for Kids | Educational Songs & Nursery Rhymes by ChuChu TV,"10,968,669 views","Oct 16, 2017",2:45
Jack and Jill Went Up the Hill (SINGLE) | Nursery Rhymes by Cutians | ChuChu TV Kids Songs,"2,811,774 views","Oct 14, 2017",2:42
Mango Song | Learn Fruits for Kids and Many More Nursery Rhymes & Kids Songs by ChuChu TV,"8,699,866 views","Oct 11, 2017",27:56
The NEW Numbers Song (SINGLE) | Learn To Count from 1 to 10 | Number Rhymes For Children | ChuChu TV,"8,759,159 views","Oct 10, 2017",3:00
Watermelon Song | Learn Fruits for Kids and Many More Nursery Rhymes & Kids Songs by ChuChu TV,"5,266,016 views","Oct 7, 2017",23:30
ABCDEF Alphabet songs with Phonics Sounds & Words for Children | Learning English with ChuChu TV,"3,723,082 views","Sep 30, 2017",16:13
"Wheels on the Bus, Lion Finger Family + More ChuChu TV Nursery Rhymes & Kids Songs","12,614,912 views","Oct 3, 2017",44:35
Learning English Is Fun™ | Alphabet “G” | ChuChu TV Phonics & Words Learning For Preschool Children,"3,929,573 views","Sep 28, 2017",6:13
"Mango Song (SINGLE) | Learn Fruits for Kids | Educational Songs, Nursery Rhymes for Kids | ChuChu TV","8,859,626 views","Sep 27, 2017",2:35
Months of the Year Song (SINGLE) – January February Song - Original Kids Nursery Rhymes | ChuChu TV,"7,468,159 views","Sep 25, 2017",4:35
Watermelon Song (SINGLE) | Learn Fruits for Kids | Educational Songs & Nursery Rhymes | ChuChu TV,"12,061,619 views","Sep 21, 2017",2:34
