Video Title,Number of Viewers,Video posting date,Video Length
"Peek-A-Poo, Peek-A-Boo! | Animal Songs | Learn Animals | Pinkfong Animal Songs for Children","116,327 views","Apr 3, 2021",1:18
Baby Shark vs Dinosaurs | +Compilation | April Fools Prank | Best Nursery Rhymes for Kids,"404,049 views","Mar 31, 2021",29:52
Robot Vacuum Cleaner Sound | Relaxing video | White noise | @Pinkfong! Baby Friends,"119,912 views","Mar 30, 2021",8:05
2 hours Baby Shark Dance Loop | Baby Shark Non-Stop | Baby Shark Dance Non Stop | +Compilation,"706,038 views","Premiered Mar 28, 2021",2:50:52
Scaredy Cat Yellow Bus | Wheels on the Bus | Car Songs | Pinkfong Baby Shark Car Videos for Children,"129,607 views","Mar 26, 2021",9:13
Yes Yes I Can Wear My Clothes | Good Habits for Children | Pinkfong Songs for Children,"229,325 views","Mar 26, 2021",2:02
Hair dryer Relaxing Sound | Visual ASMR | White noise | @Pinkfong! Baby Friends,"149,266 views","Mar 23, 2021",8:05
Baby Shark Healthy Habit Songs and more | +Compilation | Pinkfong Healthy Habits for Children,"802,784 views","Mar 21, 2021",20:08
[OUT NOW] Baby Shark Car Safety Song | Kia X Pinkfong | Kia Carnival | Pinkfong Songs for Children,"844,077 views","Mar 20, 2021",1:59
Did You See Cheetah’s Pattern? | Animal Songs | Learn Animals | Pinkfong Animal Songs for Children,"235,829 views","Mar 19, 2021",1:24
[EXCLUSIVE] Theme Song for Baby Shark's Big Show! | Nickelodeon x Baby Shark,"1,247,315 views","Mar 18, 2021",0:58
[90min] Relaxing nature sounds with Pinkfong and Hogi | Sleep Sounds ASMR | Pinkfong! Baby Friends,"183,993 views","Mar 16, 2021",1:36:06
Tooth Brushing is Fun and more | +Compilation | Good Habits for Kids | Pinkfong Songs for Children,"472,643 views","Mar 14, 2021",13:42
"Toot Toot, Hide and Seek with Shark Family | Baby Shark Story Songs | Pinkfong Songs for Children","10,657,733 views","Mar 13, 2021",5:54
"Knock, Knock! Whose Eggs? | Animal Songs | Learn Animals | Pinkfong Animal Songs for Children","654,103 views","Mar 12, 2021",1:34
Yes Yes I Can Eat By Myself | Yes Yes Vegetable | Good Habit Songs | Pinkfong Songs for Children,"89,456 views","Apr 2, 2021",1:44
Relaxing nature sounds with Pinkfong and Hogi | Sleep Sounds for Baby | @Pinkfong! Baby Friends,"318,326 views","Mar 10, 2021",8:05
Tooth Brushing Is Fun | Good Habits for Children | Pinkfong Songs for Children,"560,927 views","Mar 9, 2021",1:26
[Ongoing Limited Event] Baby Shark | Abyssrium Ver.,"918,543 views","Mar 8, 2021",1:30
First Aid Song-I got a boo boo and more | +Compilation | Safety Songs | Pinkfong Safety Rangers,"6,056,001 views","Mar 7, 2021",10:23
Towers of the World with Baby Shark | Around the World with Baby Shark | Pinkfong Songs for Children,"345,453 views","Mar 6, 2021",1:28
Good Morning Song | Good Habits for Children | Pinkfong Songs for Children,"517,613 views","Mar 2, 2021",1:30
[90 Mins] Rain Sounnd | ASMR | White Noise | Sleep Sound for Baby | @Pinkfong! Baby Friends,"186,337 views","Mar 1, 2021",1:36:06
Doctor I'm Sick! | +Compilation | Ambulance Rescue | Pinkfong Songs for Children,"1,004,826 views","Feb 28, 2021",30:10
Baby Shark World ABC | Around the World with Baby Shark | Pinkfong Songs for Children,"491,910 views","Feb 27, 2021",2:02
Guess the Animal | Animal Songs | Learn Animals | Pinkfong Animal Songs for Children,"519,022 views","Feb 26, 2021",1:29
"My Body, My Choice | Protect My Body | I Can Say No | Kids' Safety | Pinkfong Safety Rangers","681,718 views","Feb 23, 2021",1:35
Relaxing sounds of Rain with Pinkfong and Hogi | Sleep Sounds for Baby | Pinkfong! Baby Friends,"418,859 views","Feb 23, 2021",8:05
Police Car Rescue Team Special | +Compilation | Police Car Special | Pinkfong Songs for Children,"725,168 views","Feb 21, 2021",30:30
Welcome to My House | Around the World with Baby Shark | Pinkfong Songs for Children,"394,449 views","Feb 20, 2021",1:42
Savanna Night Tour | Animal Songs | Learn Animals | Pinkfong Animal Songs for Children,"511,942 views","Feb 19, 2021",1:38
"My Body, My Choice | Protect My Body | I Can Say No | Kids' Safety | Pinkfong Safety Rangers","681,737 views","Feb 23, 2021",1:35
Relaxing sounds of Rain with Pinkfong and Hogi | Sleep Sounds for Baby | Pinkfong! Baby Friends,"418,871 views","Feb 23, 2021",8:05
Police Car Rescue Team Special | +Compilation | Police Car Special | Pinkfong Songs for Children,"725,183 views","Feb 21, 2021",30:30
Welcome to My House | Around the World with Baby Shark | Pinkfong Songs for Children,"394,457 views","Feb 20, 2021",1:42
Savanna Night Tour | Animal Songs | Learn Animals | Pinkfong Animal Songs for Children,"511,946 views","Feb 19, 2021",1:38
Lion Lessons | Animal Songs | Learn Animals | Pinkfong Animal Songs for Children,"2,036,349 views","Feb 14, 2021",1:24
Valentine Sharks and more | +Compilation | Best Love Songs | Pinkfong Songs for Children,"1,497,606 views","Feb 13, 2021",1:09
Camping Safety Song | Safety Song | Stay Safe | Pinkfong Safety Rangers,"652,820 views","Feb 9, 2021",1:33
Valentine Sharks and more | +Compilation | Baby Shark Love Songs | Pinkfong Songs for Children,"1,033,404 views","Feb 7, 2021",29:15
Oceans and Continents with Baby Shark | Travel with Baby Shark | Pinkfong Songs for Children,"370,290 views","Feb 6, 2021",1:44
Jungle Music Festival | Animal Songs | Learn Animals | Pinkfong Songs for Children,"527,743 views","Feb 5, 2021",2:01
Will You Marry Me and more | +Compilation | Love Songs | Animal Songs | Pinkfong Songs for Children,"997,233 views","Jan 31, 2021",30:00
[Watch Now] Baby Shark Dance 7.8 Billion Views Special | Most Viewed Video on YouTube,"1,533,643 views","Premiered Jan 29, 2021",2:16
A Lazy Sloth | Animal Songs | Best Kids Songs | Pinkfong Songs for Children,"650,642 views","Jan 26, 2021",1:09
The World Festival with Baby Shark | Around the World with Baby Shark | Pinkfong Songs for Children,"677,407 views","Jan 23, 2021",1:36
[Now on Netflix] Pinkfong & Baby Shark's Space Adventure | Baby Shark Trailer | Children's Animation,"1,009,413 views","Jan 21, 2021",0:28
Turn off the Tap | Save the Water | Safe the Environment | Pinkfong Songs for Children,"2,691,822 views","Jan 19, 2021",2:23
[App Trailer] Baby Shark Jigsaw Puzzle Fun,"765,141 views","Jan 18, 2021",0:53
Dance with COTOMO Cats and more | +Compilation | For Kids | Pinkfong Songs for Children,"1,656,837 views","Jan 17, 2021",5:52
World Dance with Baby Shark | Around the World with Baby Shark | Pinkfong Songs for Children,"579,439 views","Jan 16, 2021",1:49
Indoor Safety Song | Shopping Mall Safety | Stay Safe | Pinkfong Safety Rangers,"771,917 views","Jan 15, 2021",1:42
The Mysterious Holes,"2,388,654 views","Jan 14, 2021",11:29
[App Trailer] Baby Shark Run Away | 🎮 Play Now! | Baby Shark Game,"650,090 views","Jan 13, 2021",0:53
[App Trailer] Pinkfong Dino World,"781,046 views","Jan 11, 2021",1:10
Baby Shark Dance and more | +Compilation | Baby Shark Workout | Pinkfong Songs for Children,"2,145,920 views","Jan 10, 2021",1:04:21
Love Is All Around the World | Around the World with Baby Shark | Pinkfong Songs for Children,"955,745 views","Jan 9, 2021",1:28
Tummy Ache Song | Pinkfong Got Tummy Ache! | Pinkfong Safety Songs | Pinkfong Songs for Children,"628,602 views","Jan 8, 2021",1:27
Bath Time,"1,546,495 views","Jan 7, 2021",11:29
Banana Caper,"951,426 views","Jan 7, 2021",11:43
[New Features] Pinkfong Dino World,"326,952 views","Jan 7, 2021",0:59
Baby Shark Dance and more | +Compilation | Happy New Year | Pinkfong Songs for Children,"2,634,117 views","Jan 3, 2021",41:40
Say Hello and Goodbye | Around the World with Baby Shark | Pinkfong Songs for Children,"535,600 views","Jan 2, 2021",1:24
Welcome to My House! | The World Song | Cotomo Cats | Pinkfong Songs for Children,"560,752 views","Jan 1, 2021",1:47
Batter Up,"1,195,700 views","Dec 31, 2020",11:55
Writer's Block,"1,242,267 views","Dec 31, 2020",11:48
No More Single-Use Plastic! | Pinkfong x Eco Drive | Reduce Plastic | Pinkfong Songs for Children,"697,378 views","Dec 29, 2020",1:34
Baby Shark Dance and more | Best Songs of the Year | +Compilation | Pinkfong Songs for Children,"2,013,047 views","Dec 27, 2020",1:23:11
The World Food Cook-off | Around the World with Baby Shark | Pinkfong Songs for Children,"838,528 views","Dec 26, 2020",1:43
Baby Shark's Christmas and more | +Compilation | Baby Shark Song | Pinkfong Songs for children,"708,623 views","Dec 25, 2020",32:21
Bumbleberry Day,"1,709,632 views","Dec 24, 2020",11:45
Puzzled Poki,"1,075,236 views","Dec 24, 2020",1:09
Christmas Sharks and more | +Compilation | Baby Shark Medley | Pinkfong Songs for Children,"1,365,448 views","Dec 23, 2020",1:02:50
The Red Nosed Baby Shark and more | +Compilation | Baby Shark Song | Pinkfong Songs for Children,"1,164,789 views","Dec 22, 2020",31:11
[Coming Soon] Pinkfong 🍼Baby Friends | 🎄Christmas ASMR | Baby Lullabies | For Babies,"175,121 views","Dec 22, 2020",1:09
The Red Nosed Baby Shark | Christmas Song | Baby Shark Song | Pinkfong Songs for Children,"1,515,182 views","Dec 19, 2020",2:14
Friendship Fix-it,"2,383,758 views","Dec 17, 2020",11:46
Poki Needs Help,"2,705,888 views","Dec 17, 2020",11:37
Christmas Sharks Spot the Difference | Christmas Song | Baby Shark | Pinkfong Songs for Children,"949,755 views","Dec 15, 2020",1:55
Baby Shark and the Snowman's Carol and more | +Compilation | Pinkfong Songs for Children,"981,438 views","Dec 13, 2020",31:11
Fishmas Special | Baby Shark's Big Fishmas | Baby Shark Music Video | Christmas Sharks | Nickelodeon,"5,876,337 views","Dec 13, 2020",3:39
"Knock, knock, Baby Shark's Christmas | Baby Shark Song | Pinkfong Songs for Children","979,084 views","Dec 12, 2020",2:28
Christmas Sharks Hide'n Seek | Christmas Story | Christmas Song | Pinkfong Songs for Children,"4,192,413 views","Dec 11, 2020",11:29
"Good Night, Jojo","3,090,249 views","Dec 10, 2020",11:47
Jungle Bells and more | +Compilation | Christmas Songs | Best Carols | Pinkfong Songs for Children,"1,029,542 views","Dec 6, 2020",31:11
Enjoy Awesome K-Food with Baby Shark | Korean Food | Pinkfong Songs for Children,"526,651 views","Dec 6, 2020",2:34
Baby Shark and the Snowman's Carol | Baby Shark Song | Pinkfong Songs for Children,"1,839,104 views","Dec 5, 2020",2:49
Giving Gifts | Baby Shark's Big Fishmas | Baby Shark Music Video | Christmas Sharks | Nickelodeon,"1,360,432 views","Dec 4, 2020",1:08
Welcome to Wonderville,"8,538,220 views","Dec 3, 2020",10:48
It's Fishmas! | Baby Shark's Big Show Teaser | Nickelodeon | Baby Shark Cartoon,"2,048,517 views","Dec 1, 2020",0:43
Join the Baby Shark Challenge | Most Viewed Video on YouTube | No.1 Video on YouTube,"1,538,010 views","Nov 30, 2020",1:09
Christmas Sharks 1hour non-stop | +Compilation | Christmas Songs | Pinkfong Songs for Children,"863,358 views","Nov 29, 2020",1:17:54
Jungle Bells | Christmas Song | Animal Song | Best Kids Songs | Pinkfong Songs for Children,"1,075,944 views","Nov 28, 2020",1:58
It's Fishmas Music Video | Baby Shark's Big Show | Christmas Song | Pinkfong Songs for Children,"1,918,842 views","Nov 27, 2020",1:28
Baby Shark's Thanksgiving Day | Thanksgiving Song | Baby Shark Song | Pinkfong Songs for Children,"1,015,355 views","Nov 26, 2020",2:33
Fishmas Announcement Teaser | Baby Shark's Big Show | Baby Shark's Big Fishmas,"2,054,358 views","Nov 24, 2020",0:41
Lalala World Clothes | The World Song | Cotomo Cats | Pinkfong Songs for Children,"580,652 views","Nov 24, 2020",1:40
Christmas Sharks and more | Best Christmas Songs | +Compilation | Pinkfong Songs for Children,"4,041,093 views","Nov 22, 2020",1:08:20
The World Food Cook-off | Around the World with Baby Shark | Pinkfong Songs for Children,"1,131,075 views","Nov 21, 2020",1:42
First Aid Song | I got a boo boo song | Pinkfong Safety Songs | Pinkfong Songs for Children,"28,752,959 views","Nov 20, 2020",1:37
Pinkfong Wonderstar | Official Trailer | YouTube Originals,"5,160,723 views","Nov 18, 2020",1:00
Baby Shark Dance and more | +Compilation | Baby Shark Swims to the TOP | Pinkfong Songs for Children,"11,530,486 views","Nov 15, 2020",43:38
Water Safety Song | Pinkfong Safety Songs | Swimming Safety | Pinkfong Songs for Children,"1,414,179 views","Nov 13, 2020",1:33
Baby Shark World Tour | Around the World with Baby Shark | Pinkfong Songs for Children,"1,217,014 views","Nov 13, 2020",1:18
"Baby Shark Dance, the Most Watched Video | Baby Shark Dance | Pinkfong Songs for Children","2,778,826 views","Nov 11, 2020",1:46
Come to Awesome Korea | Visit Seoul | Incheon Airport | Travel Song | Pinkfong Songs for Children,"1,536,538 views","Nov 10, 2020",2:24
Baby Shark Dance and more | +Compilation | Best Kids Songs | Pinkfong Songs for Children,"124,142,757 views","Nov 8, 2020",56:52
Baby Shark's Retro Party | Baby Shark Retro Version | Pinkfong Songs for Children,"7,228,749 views","Nov 7, 2020",1:47
"Go away, Yellow Dust | Pinkfong Safety Songs | Healthy Habits | Pinkfong Songs for Children","7,165,339 views","Nov 6, 2020",1:38
Dance with COTOMO Cats | The World Song | Cotomo Cats | Pinkfong Songs for Children,"6,314,169 views","Nov 3, 2020",1:43
Day of the Dead and more | +Compilation | Halloween Songs | Pinkfong Songs for Children,"10,809,235 views","Oct 31, 2020",19:36
Chumbala Cachumbala and more | +Compilation | Halloween Songs | Pinkfong Songs for Children,"59,427,325 views","Oct 30, 2020",1:09
Halloween Zombie Sharks and more | +Compilation | Halloween Baby Shark | Pinkfong Songs for Children,"56,372,154 views","Oct 27, 2020",19:36
Best Pinkfong Halloween Songs | +Compilation | Baby Shark Halloween | Halloween Songs for Children,"7,397,157 views","Oct 25, 2020",18:15
Halloween Hide'n Seek with Baby Shark Family | Halloween Songs | Pinkfong Songs for Children,"31,947,464 views","Oct 24, 2020",10:00
Haunted House & Draw a Spider | Halloween Songs | Pinkfong Songs for Children,"902,372 views","Oct 23, 2020",2:51
Halloween Zombie Shark | Baby Shark Halloween | Halloween Song | Pinkfong Halloween Songs,"8,591,858 views","Oct 20, 2020",2:05
Haunted House and more | +Compilation | Halloween Songs | Pinkfong Songs for Children,"1,817,581 views","Oct 18, 2020",21:05
Chumbala Cachumbala Dance | Halloween Songs | Pinkfong Halloween | Pinkfong Songs for Children,"18,321,341 views","Oct 17, 2020",1:09
Ghost on the Coast & Draw Frankenstein | Halloween Songs | How to Draw | Pinkfong Songs for Children,"2,234,599 views","Oct 16, 2020",1:09
Baby Shark Halloween Bus | +Compilation | Halloween Songs | Pinkfong Songs for Children,"4,628,659 views","Oct 11, 2020",19:36
Day of the Dead with Baby Shark | Halloween Songs | Pinkfong Songs for Children,"4,512,810 views","Oct 10, 2020",1:53
Vampire Wedding & Bat Drawing | Halloween Songs | How to Draw | Pinkfong Songs for Children,"2,697,055 views","Oct 9, 2020",3:15
Thank You Heroes | Health Care Workers | Frontliners | Thank You Song | Pinkfong Songs for Children,"73,484,060 views","Oct 6, 2020",1:15
Baby Shark Halloween Bus | Halloween Songs | Baby Shark Halloween | Pinkfong Songs for Children,"2,905,316 views","Oct 3, 2020",1:47
The Little Ghost song & Ghost Drawing | Halloween Songs | How to Draw | Pinkfong Songs for Children,"962,757 views","Oct 2, 2020",2:20
[App Trailer] Pinkfong Baby Shark,"18,008,168 views","Sep 30, 2020",1:01
Halloween Sharks 1hour Non-Stop | +Compilation | Baby Shark Non-Stop | Pinkfong Halloween Songs,"6,708,624 views","Sep 27, 2020",1:35:04
Halloween Mermaid Wedding | Halloween Songs | Baby Shark Halloween | Pinkfong Songs for Children,"1,612,838 views","Sep 26, 2020",1:49
Animal Sounds | Word Power | Word Song | Pinkfong Songs for Children,"977,747 views","Sep 22, 2020",1:15
I’m an Allosaurus | Dinosaur Musical | Dinosaur Story | Pinkfong Songs for Children,"3,762,188 views","Sep 18, 2020",6:50
Yum Yum World Foods | The World Song | Cotomo Cats | Pinkfong Songs for Children,"2,480,810 views","Sep 18, 2020",1:43
Eight Planets and more | +Compilation | Science Songs Special | Pinkfong Songs for Children,"2,991,345 views","Sep 15, 2020",17:38
Halloween Dinosaurs | Spot the Difference | Halloween Songs | Pinkfong Songs for Children,"2,652,559 views","Sep 13, 2020",1:43
Halloween Baby Car | Spot the Difference | Halloween Songs | Pinkfong Songs for Children,"10,513,767 views","Sep 12, 2020",1:36
Hospital Play and more | +Compilation | Science Songs Special | Pinkfong Songs for Children,"19,794,768 views","Sep 11, 2020",17:04
Dig Up Dinosaur Bones and more | +Compilation | Science Songs Special | Pinkfong Songs for Children,"761,863 views","Sep 9, 2020",17:10
Oviraptor the Egg Thief | Dinosaur Musical | Dinosaur Story | Pinkfong Songs for Children,"1,974,620 views","Sep 5, 2020",6:34
Singer Whale and Whale Drawing Song | Sing and Draw | Pinkfong Songs for Children,"3,976,817 views","Sep 1, 2020",2:48
Ten Little Spooky Kids and more | Ten Little Kids | +Compilation | Pinkfong Songs for Children,"5,279,715 views","Aug 30, 2020",21:22
Scared Baby T-Rex | Dinosaur Musical | Dinosaur Story | Pinkfong Songs for Children,"7,167,737 views","Aug 29, 2020",6:16
Pinkfong Baby Shark Sandbox Play | Toy Show | Sand Toys | Toy Review | Pinking Toy Show for Children,"1,122,588 views","Aug 28, 2020",8:00
"Draw an Octopus and Ooh La la, Octopus | Sing and Draw | Pinkfong Songs for Children","1,094,228 views","Aug 25, 2020",2:49
Doo doo doo Shark and more | +Compilation | Best Kids Songs | Pinkfong Songs for Children,"3,409,253 views","Aug 23, 2020",52:40
Spinosaurus vs Tyrannosaurus Rex | Dinosaur Musical | Dinosaur Story | Pinkfong Songs for Children,"4,419,640 views","Aug 22, 2020",6:23
Draw a Crab and Clap Snap Lobster | Sing and Draw | Pinkfong Songs for Children,"548,573 views","Aug 21, 2020",3:11
[App Trailer] Pinkfong Baby Shark Phone,"1,706,727 views","Aug 18, 2020",2:15
[New Features] Pinkfong Baby Shark Phone,"1,240,452 views","Aug 17, 2020",0:37
Shark Week with Baby Shark | +Compilation | Baby Shark Show | Pinkfong Songs for Children,"3,782,161 views","Aug 16, 2020",29:09
It's Baby Shark's Big Week! | +Compilation | Nick Jr. x Baby Shark | Pinkfong Songs for Children,"1,367,958 views","Aug 16, 2020",48:12
Save the Sea Animals | Shark Week with Baby Shark | Pinkfong Songs for Children,"1,614,559 views","Aug 15, 2020",1:39
Save the Sea Animals with Baby Shark | Shark Week with Baby Shark | Pinkfong Songs for Children,"1,087,455 views","Aug 15, 2020",4:21
Dance and Move like Sea Animals | Shark Week with Baby Shark | Pinkfong Songs for Children,"1,495,844 views","Aug 14, 2020",4:21
Meet the Naughty Ocean Friends | Shark Week with Baby Shark | Pinkfong Songs for Children,"1,293,314 views","Aug 12, 2020",4:21
Meet the Shark Family | Shark Week with Baby Shark | Pinkfong Songs for Children,"1,771,348 views","Aug 11, 2020",4:21
Baby Shark and Undersea Friends | Shark Week with Baby Shark | Pinkfong Songs for Children,"4,325,082 views","Aug 10, 2020",4:21
Happy Shark Week with Baby Shark | Baby Shark Show | Pinkfong Songs for Children,"4,108,188 views","Aug 9, 2020",3:51
"Baby Nick Jr. | Sing with Baby Shark, Blaze, Gil and Blue | Nick Jr. Crew x Baby Shark","794,795 views","Aug 9, 2020",3:03
Save the Sea Animals and more | +Compilation | Shark Week | Pinkfong Songs for Children,"1,219,583 views","Aug 7, 2020",20:29
[App Trailer] Pinkfong! Baby Shark App,"17,788,206 views","Aug 5, 2020",0:20
Clean the Sea and more | +Compilation | Shark Week | Pinkfong Songs for Children,"1,660,295 views","Aug 2, 2020",21:53
Rain rain Go Away and more | Rainy Day Special | +Compilation | Pinkfong Songs for Children,"1,299,959 views","Aug 1, 2020",1:09
Baby Shark Workout | 10 MIN Exercise with Baby Shark | Pinkfong Songs for Children,"873,881 views","Jul 31, 2020",10:56
[Music Video] Jam into Baby Shark POP!,"1,249,368 views","Jul 30, 2020",1:57
Pinkfong Spot the difference: Finding Baby Shark,"832,648 views","Jul 28, 2020",0:18
Doo doo doo Shark and more | +Compilation | Pinkfong Songs for Children,"2,662,069 views","Jul 26, 2020",1:09
The Panda Song and more | +Compilation | Animal Songs | Pinkfong Songs for Children,"1,150,677 views","Jul 24, 2020",12:57
Draw a Baby Piggy and Did You Ever See My Tail? | Sing and Draw | Pinkfong Songs for Children,"1,851,313 views","Jul 21, 2020",2:34
The Penguin Dance and more | Clay and Dance | +Compilation | Pinkfong Songs for Children,"2,035,149 views","Jul 19, 2020",21:39
Pinkfong Baby Shark Fishing Play | Toy Show | Pinkfong Songs for Children,"895,882 views","Jul 18, 2020",6:55
Natural Disaster Safety Song | Pinkfong Safety Rangers | Pinkfong Songs for Children,"901,227 views","Jul 17, 2020",1:24
"Baby Shark, featuring Luis Fonsi | Baby Shark Song | Pinkfong Songs for Children","346,783,539 views","Jul 15, 2020",1:42
The Kitty Song and more | +Compilation | Animal Songs | Pinkfong Songs for Children,"3,215,592 views","Jul 12, 2020",30:37
Dance Tutorial: Let's Sing with Joy | Pinkfong Baby Shark LIVE | Pinkfong Songs for Children,"1,496,502 views","Jul 11, 2020",2:05
Tyrannosaurus Rex and more | +Compilation | Dino Adventure | Pinkfong Songs for Children,"6,656,776 views","Jul 5, 2020",40:46
Dance Tutorial: I've Got the Rhthym | Pinkfong Baby Shark LIVE | Pinkfong Songs for Children,"975,414 views","Jul 4, 2020",3:09
[Music Video] Jam into Baby Shark POP!,"1,788,764 views","Jun 28, 2020",2:31
Paw Paw Polar Bear and Make Clay Polar Bear | Clay and Dance | Pinkfong Songs for Children,"621,606 views","Jun 26, 2020",3:55
"You May Be Far, But Still Our Hearts Are Close | Healthy Habits | Pinkfong Songs for Children","3,967,423 views","Jun 22, 2020",2:22
Baby Shark Dance and more | Best Summer Songs | +Compilation | Pinkfong Songs for Children,"66,540,828 views","Jun 21, 2020",53:53
The Kitty Song and Make Cat with Clay | Clay and Dance | Pinkfong Songs for Children,"3,441,570 views","Jun 19, 2020",5:12
Pinkfong Spot the difference: Finding Baby Shark,"1,607,429 views","Jun 16, 2020",0:29
Healthy Habits while Social distancing | Let’s learn Healthy Habits | Pinkfong Songs For Children,"2,622,383 views","Jun 15, 2020",2:21
Likey Likey Ice Cream Song and more | +Compilation | Snack Time | Pinkfong Songs for Children,"3,696,840 views","Jun 14, 2020",29:01
Did You Ever See My Tail and Make Pig with Clay | Clay and Dance | Pinkfong Songs for Children,"737,089 views","Jun 12, 2020",4:40
Cheeky Monkey | Animal Songs | Monkey Song | Pinkfong Songs for Children,"6,923,820 views","Jun 9, 2020",1:21
Five Little Monkeys and more | Best Nursery Rhymes | +Compilation | Pinkfong Songs for Children,"6,618,164 views","Jun 6, 2020",32:14
Monkey Bananas Dance and Make Monkey with Clay | Clay and Dance | Pinkfong Songs for Children,"1,394,516 views","Jun 6, 2020",3:33
Rap a Tap | ABC Phonics | ABC Songs | Pinkfong Songs for Children,"619,359 views","Jun 5, 2020",1:18
Likey Likey Ice Cream Song and more | +Compilation | Pinkfong Songs for Children,"1,701,022 views","Jun 2, 2020",20:42
Social Distance Song | 5 Steps on Social Distancing | Pinkfong Songs For Children,"3,670,382 views","Jun 1, 2020",1:31
The Penguin Dance and Make Penguin with Clay | Clay and Dance | Pinkfong Songs for Children,"1,328,153 views","May 31, 2020",4:48
Crunchy Sweet Tanghulu | Snack Song | Panda Songs | Pinkfong Songs for Children,"710,018 views","May 29, 2020",1:11
Bored at home? Join #HogiDoorDanceChallenge | Dance with Hogi | @Hogi! Pinkfong - Learn & Play,"872,139 views","May 27, 2020",0:27
[Trailer] Baby Shark VR Dancing game trailer | Baby Shark VR available on SteamVR,"1,438,633 views","May 26, 2020",1:15
Baby Shark Dance and more | Best Nursery Rhymes | +Compilation | Pinkfong Songs for Children,"13,273,660 views","May 24, 2020",32:12
The Panda Song | Hey Hey Panda Dance | Panda Songs | Pinkfong Songs for Children,"2,493,743 views","May 23, 2020",1:34
Traffic Lights and more | Traffic Safety Songs | +Compilation | Pinkfong Songs for Children,"824,704 views","May 22, 2020",18:36
Super Duper Manta Ray and more | Sea Animal Songs | +Compilation | Pinkfong Songs for Children,"5,525,802 views","May 17, 2020",19:35
Doo doo doo Shark | Sea Animal Songs | Animal Songs | Pinkfong Songs for Children,"3,062,845 views","May 16, 2020",1:21
Baby T-Rex and more | Dinosaur T-Rex Songs | +Compilation | Pinkfong Songs for Children,"2,896,961 views","May 15, 2020",18:19
Faster Baby Shark | Dance Dance | Faster Baby Shark Dance | Pinkfong Songs for Children,"5,205,219 views","May 12, 2020",1:19
Wash Your Hands and more | Self Hygiene | +Compilation | Pinkfong Songs for Children,"1,703,191 views","May 10, 2020",20:35
How to make Clay Sea Animals | +Compilation | Arts and Crafts | Pinkfong Craft time for Children,"2,481,319 views","May 8, 2020",1:09
Move Like Sea Animals | Sea Animal Songs | Animal Songs | Pinkfong Songs for Children,"4,153,941 views","May 5, 2020",1:09
Good Morning and more | +Compilation | Morning Songs | Pinkfong Songs for Children,"3,202,613 views","May 3, 2020",44:39
"Hoy-hoy, Coral | Sea Animal Songs | Animal Songs | Pinkfong Songs for Children","584,134 views","May 2, 2020",1:28
Come to Ulsan Korea | Ulsan Song | Visit Ulsan | Ulsan City Tour | Pinkfong Songs for Children,"1,138,865 views","Apr 29, 2020",2:33
"Hey, Mommy Shark and more | +Compilation | Mother's Day Special | Pinkfong Songs for Children","3,767,987 views","Apr 28, 2020",41:03
Ten Little Frog Kids and more | +Compilation | Spring Songs | Pinkfong Songs for Children,"1,112,085 views","Apr 26, 2020",29:27
"Wibble wobble, Jellyfish | Sea Animal Songs | Animal Songs | Pinkfong Songs for Children","698,781 views","Apr 25, 2020",1:38
How to Make a Clay Turtle | Clay Animals | Arts and Crafts | Pinkfong Craft time for Children,"1,137,805 views","Apr 24, 2020",4:42
[App Trailer] Baby Shark: Wash Your Hands | #BabySharkHandWashChallenge | #StayHome,"2,331,021 views","Apr 23, 2020",0:26
Join #HogiDoorDanceChallenge | Open the Door and Meet Hogi | @Hogi! Pinkfong - Learn & Play,"472,173 views","Apr 21, 2020",0:22
